{
  "schemaVersion": "data.harness/v1",
  "kind": "ReferenceLabManifest",
  "labId": "white-goods-service-quality-lab",
  "industry": "white-goods manufacturing",
  "domain": "after-sales service and manufacturing quality",
  "datasets": ["master-data-v1", "service-orders-v1", "quality-inspections-v1", "telemetry-events-v1", "technical-documents-v1", "service-api-v1"],
  "connectors": ["whitegoods.erp", "whitegoods.documents", "whitegoods.telemetry", "whitegoods.service-api", "whitegoods.search"],
  "deploymentProfiles": ["self-hosted", "air-gapped"],
  "acceptanceScenarios": ["deterministic-reset", "connector-fidelity", "authorization-negative-paths", "failure-injection", "checkpoint-replay", "semantic-correctness", "retrieval-quality", "performance-budget", "zero-egress"]
}
